{
  "protocol": "tmux-observer.attachments-delivery.v1",
  "schemaVersion": 1,
  "publisherId": "11111111-1111-4111-8111-111111111111",
  "requestId": "fixture-1",
  "source": {
    "hostId": "fixture-local",
    "uid": 1000,
    "server": "default",
    "nativeHostname": "fixture-local"
  },
  "clock": {
    "bootId": "00000000-0000-4000-8000-000000000000",
    "timeNamespace": "time:10"
  },
  "pidNamespace": "pid:10",
  "encodedAt": 130,
  "receipt": {
    "state": "ready",
    "attempted": 1,
    "accepted": 1,
    "acceptedAttempt": 1,
    "startedAt": 100,
    "acceptedAt": 125,
    "expiresAt": 10100,
    "lastAttemptAt": 100,
    "lastAttemptResult": "complete",
    "leaseMs": 10000,
    "remainingMs": 9970,
    "inFlight": false
  },
  "snapshot": {
    "protocol": "tmux-observer.attachments.v1",
    "schemaVersion": 1,
    "source": {
      "hostId": "fixture-local",
      "uid": 1000,
      "server": "default",
      "nativeHostname": "fixture-local"
    },
    "clock": {
      "bootId": "00000000-0000-4000-8000-000000000000",
      "timeNamespace": "time:10"
    },
    "pidNamespace": "pid:10",
    "sample": {
      "startedAt": 100,
      "finishedAt": 120,
      "observedAt": 1700000000000,
      "coverage": "complete",
      "error": null
    },
    "serverGeneration": "tmux-v1:1700000000:4321:/tmp/tmux-fixture/default",
    "sessions": [
      {
        "hostId": "fixture-local",
        "serverGeneration": "tmux-v1:1700000000:4321:/tmp/tmux-fixture/default",
        "sessionId": "$2",
        "createdAt": 1700000001
      }
    ],
    "clients": [
      {
        "sessionRef": {
          "hostId": "fixture-local",
          "serverGeneration": "tmux-v1:1700000000:4321:/tmp/tmux-fixture/default",
          "sessionId": "$2",
          "createdAt": 1700000001
        },
        "clientPid": 123,
        "processStartTicks": 456
      }
    ]
  },
  "error": null
}
